{
  "meta": {
    "year": 2025,
    "month": 12,
    "weekNumber": 1,
    "range": "2025.12.01 ~ 12.07",
    "title": "2025년 12월 1주차 주간 UV 레포트현황"
  },
  "summary": {
    "totalUV": 450710,
    "prevTotalUV": 465920,
    "growth": -3.3,
    "mobileShare": 77,
    "bestGrowth": {
      "name": "해외항공 (예약완료)",
      "rate": 45.5
    },
    "worstDrop": {
      "name": "해외호텔 (예약)",
      "rate": -37.5
    }
  },
  "trend": [
    {
      "name": "10월 5주",
      "uv": 418163
    },
    {
      "name": "11월 1주",
      "uv": 468304
    },
    {
      "name": "11월 2주",
      "uv": 434859
    },
    {
      "name": "11월 3주",
      "uv": 480351
    },
    {
      "name": "11월 4주",
      "uv": 465920
    },
    {
      "name": "12월 1주",
      "uv": 450710
    }
  ],
  "device": [
    {
      "name": "Mobile",
      "value": 77
    },
    {
      "name": "PC",
      "value": 23
    }
  ],
  "categories": [
    {
      "group": "공통",
      "items": [
        {
          "name": "전체",
          "current": 450710,
          "prev": 465920,
          "rate": -3.3
        },
        {
          "name": "메인",
          "current": 42280,
          "prev": 34480,
          "rate": 22.6
        },
        {
          "name": "검색",
          "current": 103240,
          "prev": 101790,
          "rate": 1.4
        }
      ]
    },
    {
      "group": "패키지",
      "items": [
        {
          "name": "대표상품",
          "current": 137430,
          "prev": 130260,
          "rate": 5.5
        },
        {
          "name": "상품상세",
          "current": 119580,
          "prev": 115680,
          "rate": 3.4
        },
        {
          "name": "예약하기",
          "current": 2850,
          "prev": 2530,
          "rate": 12.6
        },
        {
          "name": "예약완료",
          "current": 1120,
          "prev": 930,
          "rate": 20.4
        }
      ]
    },
    {
      "group": "항공(해외)",
      "items": [
        {
          "name": "서브메인",
          "current": 6740,
          "prev": 5270,
          "rate": 27.9
        },
        {
          "name": "검색(해외)",
          "current": 5140,
          "prev": 4180,
          "rate": 23
        },
        {
          "name": "약관동의",
          "current": 20970,
          "prev": 18120,
          "rate": 15.7
        },
        {
          "name": "예약정보입력",
          "current": 18530,
          "prev": 16000,
          "rate": 15.8
        },
        {
          "name": "예약완료",
          "current": 8480,
          "prev": 5830,
          "rate": 45.5
        }
      ]
    },
    {
      "group": "호텔(해외)",
      "items": [
        {
          "name": "서브메인",
          "current": 3690,
          "prev": 3910,
          "rate": -5.6
        },
        {
          "name": "상품리스팅",
          "current": 2120,
          "prev": 2290,
          "rate": -7.4
        },
        {
          "name": "상품상세",
          "current": 100680,
          "prev": 151610,
          "rate": -33.6
        },
        {
          "name": "예약하기",
          "current": 72320,
          "prev": 115730,
          "rate": -37.5
        },
        {
          "name": "결제완료",
          "current": 1470,
          "prev": 2400,
          "rate": -38.8
        }
      ]
    },
    {
      "group": "마이페이지",
      "items": [
        {
          "name": "메인",
          "current": 3880,
          "prev": 2590,
          "rate": 49.8
        },
        {
          "name": "패키지",
          "current": 2000,
          "prev": 2200,
          "rate": -9.1
        },
        {
          "name": "해외항공",
          "current": 1800,
          "prev": 920,
          "rate": 95.7
        },
        {
          "name": "국내항공",
          "current": 3530,
          "prev": 3350,
          "rate": 5.4
        },
        {
          "name": "호텔",
          "current": 1480,
          "prev": 1120,
          "rate": 32.1
        }
      ]
    }
  ],
  "coBrandTop20": [
    {
      "rank": 1,
      "name": "호텔스컴바인",
      "type": "제휴채널",
      "uv": 87615,
      "growth": -60.2
    },
    {
      "rank": 2,
      "name": "세주여행사",
      "type": "브랜드몰",
      "uv": 45534,
      "growth": 5.3
    },
    {
      "rank": 3,
      "name": "스카이스캐너",
      "type": "제휴채널",
      "uv": 40806,
      "growth": 35
    },
    {
      "rank": 4,
      "name": "새서울여행사",
      "type": "브랜드몰",
      "uv": 21313,
      "growth": 4.2
    },
    {
      "rank": 5,
      "name": "드림패키지",
      "type": "브랜드몰",
      "uv": 20716,
      "growth": 21.7
    },
    {
      "rank": 6,
      "name": "네이버",
      "type": "제휴채널",
      "uv": 20587,
      "growth": 30.4
    },
    {
      "rank": 7,
      "name": "트립페이지",
      "type": "브랜드몰",
      "uv": 18813,
      "growth": -3
    },
    {
      "rank": 8,
      "name": "하나이엔비티",
      "type": "브랜드몰",
      "uv": 11657,
      "growth": 1.7
    },
    {
      "rank": 9,
      "name": "남강트레블서비스",
      "type": "브랜드몰",
      "uv": 10113,
      "growth": 10.3
    },
    {
      "rank": 10,
      "name": "나이스하나",
      "type": "브랜드몰",
      "uv": 9489,
      "growth": -9.3
    },
    {
      "rank": 11,
      "name": "컨텐츠월드",
      "type": "브랜드몰",
      "uv": 8964,
      "growth": -10.3
    },
    {
      "rank": 12,
      "name": "윙메이트",
      "type": "브랜드몰",
      "uv": 8763,
      "growth": 11.6
    },
    {
      "rank": 13,
      "name": "도도투어",
      "type": "브랜드몰",
      "uv": 8310,
      "growth": 20.8
    },
    {
      "rank": 14,
      "name": "다온투어",
      "type": "브랜드몰",
      "uv": 8300,
      "growth": 10.5
    },
    {
      "rank": 15,
      "name": "황금여행사",
      "type": "브랜드몰",
      "uv": 8253,
      "growth": 1.5
    },
    {
      "rank": 16,
      "name": "리컴퍼니",
      "type": "브랜드몰",
      "uv": 8016,
      "growth": 2.6
    },
    {
      "rank": 17,
      "name": "트립나우",
      "type": "브랜드몰",
      "uv": 7847,
      "growth": -5.2
    },
    {
      "rank": 18,
      "name": "한국교육여행사",
      "type": "브랜드몰",
      "uv": 7644,
      "growth": -3.4
    },
    {
      "rank": 19,
      "name": "구글코리아",
      "type": "제휴채널",
      "uv": 7215,
      "growth": -7.1
    },
    {
      "rank": 20,
      "name": "케이에이피투어",
      "type": "브랜드몰",
      "uv": 7149,
      "growth": 0
    }
  ],
  "detailedTop10": {
    "brandMall": {
      "totalUV": 151256,
      "growth": -3.2,
      "data": [
        {
          "rank": 1,
          "name": "세주여행사",
          "uv": 45534
        },
        {
          "rank": 2,
          "name": "새서울여행사",
          "uv": 21313
        },
        {
          "rank": 3,
          "name": "트립페이지",
          "uv": 18813
        },
        {
          "rank": 4,
          "name": "하나이엔비티",
          "uv": 11657
        },
        {
          "rank": 5,
          "name": "남강트레블서비스",
          "uv": 10113
        },
        {
          "rank": 6,
          "name": "나이스하나",
          "uv": 9489
        },
        {
          "rank": 7,
          "name": "컨텐츠월드",
          "uv": 8964
        },
        {
          "rank": 8,
          "name": "윙메이트",
          "uv": 8763
        },
        {
          "rank": 9,
          "name": "도도투어",
          "uv": 8310
        },
        {
          "rank": 10,
          "name": "다온투어",
          "uv": 8300
        }
      ]
    },
    "affiliate": {
      "totalUV": 165160,
      "growth": -17,
      "data": [
        {
          "rank": 1,
          "name": "호텔스컴바인",
          "uv": 87615
        },
        {
          "rank": 2,
          "name": "스카이스캐너",
          "uv": 40806
        },
        {
          "rank": 3,
          "name": "네이버",
          "uv": 20587
        },
        {
          "rank": 4,
          "name": "구글코리아",
          "uv": 7215
        },
        {
          "rank": 5,
          "name": "롯데카드[해외]",
          "uv": 2363
        },
        {
          "rank": 6,
          "name": "하나투어[카약]",
          "uv": 1488
        },
        {
          "rank": 7,
          "name": "골프존카운티",
          "uv": 1362
        },
        {
          "rank": 8,
          "name": "삼성카드[임직원몰]",
          "uv": 1326
        },
        {
          "rank": 9,
          "name": "하나카드[VIP]",
          "uv": 1246
        },
        {
          "rank": 10,
          "name": "더케이교직원나라",
          "uv": 1152
        }
      ]
    },
    "officialCenter": {
      "totalUV": 16558,
      "growth": 43.2,
      "data": [
        {
          "rank": 1,
          "name": "여행의달인",
          "uv": 4327
        },
        {
          "rank": 2,
          "name": "순이엔티",
          "uv": 2810
        },
        {
          "rank": 3,
          "name": "홈쇼핑모아",
          "uv": 2782
        },
        {
          "rank": 4,
          "name": "H.브릿지",
          "uv": 1865
        },
        {
          "rank": 5,
          "name": "하나투어리스트[온라인]",
          "uv": 1456
        },
        {
          "rank": 6,
          "name": "부산은성관광",
          "uv": 874
        },
        {
          "rank": 7,
          "name": "모먼트 스튜디오",
          "uv": 840
        },
        {
          "rank": 8,
          "name": "엠에스투어",
          "uv": 555
        },
        {
          "rank": 9,
          "name": "하나이엔비티",
          "uv": 536
        },
        {
          "rank": 10,
          "name": "나침반여행사",
          "uv": 513
        }
      ]
    }
  },
  "aiInsight": [
    {
      "title": "전체 트래픽: 전주 대비 -3.3% 감소",
      "content": "전체 UV는 450,710으로 전주(465,920) 대비 -3.3% 감소했으며, 모바일(CBM)이 76.8%, PC(CBP)가 23.2%의 비중을 차지하고 있습니다."
    },
    {
      "title": "호조 부문: 해외항공 예약 전환율 급상승",
      "content": "해외항공 UV가 6,740으로 전주 대비 +27.9% 상승했으며, 연관 지표인 마이페이지 해외항공 섹션도 1,800으로 전주 대비 +95.7% 급증했습니다."
    },
    {
      "title": "부진 부문: 호텔 상세페이지 트래픽 급감",
      "content": "호텔 상세페이지 UV가 100,680으로 전주(151,610) 대비 -33.6% 급감했으며, 예약전환율도 하락세를 보이고 있어 시즌 오프 및 가격 경쟁력 약화가 원인으로 추정됩니다."
    },
    {
      "title": "채널 분석: OTA 플랫폼 비중 확대",
      "content": "상위 10개 코브랜드 도메인 중 호텔스컴바인, 스카이스캐너 등 OTA가 30%, 여행사가 50%, 카드사 제휴채널이 20%를 차지하며, OTA 의존도가 증가하는 추세입니다."
    }
  ]
}